{
  "$schema": "https://raw.githubusercontent.com/mxmvncnt/desktop-rs/main/docs/theme.schema.json",
  "id": "nord",
  "label": "Nord",
  "dark": {
    "bg": "#2e3440",
    "surface": "#272c36",
    "card": "#2b303b",
    "overlay": "#3b4252",
    "raised": "#434c5e",
    "text": "#d8dee9",
    "muted": "#aab2c0",
    "faint": "#7b88a1",
    "accent": "#88c0d0",
    "accent_strong": "#5e81ac",
    "danger": "#d0707a",
    "warning": "#ebcb8b",
    "success": "#a3be8c",
    "on_accent": "#2e3440",
    "comment": "#616e88",
    "keyword": "#81a1c1",
    "string": "#a3be8c",
    "number": "#b48ead",
    "special": "#ebcb8b"
  },
  "light": {
    "bg": "#eceff4",
    "surface": "#e5e9f0",
    "card": "#e9edf3",
    "overlay": "#f6f8fb",
    "raised": "#d8dee9",
    "text": "#2e3440",
    "muted": "#4c566a",
    "faint": "#6b7690",
    "accent": "#5e81ac",
    "accent_strong": "#4c6f9a",
    "danger": "#bf616a",
    "warning": "#b5832a",
    "success": "#5f8a4a",
    "on_accent": "#ffffff",
    "comment": "#8a93a6",
    "keyword": "#5e81ac",
    "string": "#5f8a4a",
    "number": "#9b6a95",
    "special": "#b5832a"
  }
}
