{
  "$schema": "https://raw.githubusercontent.com/mxmvncnt/desktop-rs/main/docs/theme.schema.json",
  "id": "catppuccin",
  "label": "Catppuccin",
  "dark": {
    "bg": "#1e1e2e",
    "surface": "#181825",
    "card": "#1a1a29",
    "overlay": "#313244",
    "raised": "#313244",
    "text": "#cdd6f4",
    "muted": "#a6adc8",
    "faint": "#7f849c",
    "accent": "#89b4fa",
    "accent_strong": "#5b8bdc",
    "danger": "#f38ba8",
    "warning": "#f9e2af",
    "success": "#a6e3a1",
    "on_accent": "#1e1e2e",
    "comment": "#6c7086",
    "keyword": "#cba6f7",
    "string": "#a6e3a1",
    "number": "#fab387",
    "special": "#f2cdcd"
  },
  "light": {
    "bg": "#eff1f5",
    "surface": "#e6e9ef",
    "card": "#ebedf2",
    "overlay": "#fcfcfd",
    "raised": "#ccd0da",
    "text": "#4c4f69",
    "muted": "#5c5f77",
    "faint": "#8c8fa1",
    "accent": "#1e66f5",
    "accent_strong": "#1a56d6",
    "danger": "#d20f39",
    "warning": "#df8e1d",
    "success": "#40a02b",
    "on_accent": "#ffffff",
    "comment": "#9ca0b0",
    "keyword": "#8839ef",
    "string": "#40a02b",
    "number": "#fe640b",
    "special": "#dd7878"
  }
}
