{
  "$schema": "https://raw.githubusercontent.com/mxmvncnt/desktop-rs/main/docs/theme.schema.json",
  "id": "solarized",
  "label": "Solarized",
  "dark": {
    "bg": "#002b36",
    "surface": "#00212b",
    "card": "#00252f",
    "overlay": "#073642",
    "raised": "#0b3f4c",
    "text": "#93a1a1",
    "muted": "#839496",
    "faint": "#657b83",
    "accent": "#268bd2",
    "accent_strong": "#1e6fa8",
    "danger": "#dc322f",
    "warning": "#b58900",
    "success": "#859900",
    "on_accent": "#002b36",
    "comment": "#586e75",
    "keyword": "#859900",
    "string": "#2aa198",
    "number": "#d33682",
    "special": "#d33682"
  },
  "light": {
    "bg": "#fdf6e3",
    "surface": "#eee8d5",
    "card": "#f5eed9",
    "overlay": "#fffaf0",
    "raised": "#e4ddc8",
    "text": "#586e75",
    "muted": "#657b83",
    "faint": "#93a1a1",
    "accent": "#268bd2",
    "accent_strong": "#1e6fa8",
    "danger": "#dc322f",
    "warning": "#b58900",
    "success": "#859900",
    "on_accent": "#ffffff",
    "comment": "#93a1a1",
    "keyword": "#859900",
    "string": "#2aa198",
    "number": "#d33682",
    "special": "#d33682"
  }
}
