{
  "$schema": "https://raw.githubusercontent.com/mxmvncnt/desktop-rs/main/docs/theme.schema.json",
  "id": "default",
  "label": "Default",
  "dark": {
    "bg": "#060606",
    "surface": "#0d0d0d",
    "card": "#0e0e0e",
    "overlay": "#161616",
    "raised": "#1e1e1e",
    "text": "#e5e5e5",
    "muted": "#a1a1a1",
    "faint": "#737373",
    "accent": "#51a2ff",
    "accent_strong": "#155dfc",
    "danger": "#ff6467",
    "warning": "#ffb900",
    "success": "#00d492",
    "on_accent": "#fafafa",
    "comment": "#808080",
    "keyword": "#8f96ed",
    "string": "#1eb787",
    "number": "#dba924",
    "special": "#e679b4"
  },
  "light": {
    "bg": "#ffffff",
    "surface": "#f6f6f6",
    "card": "#fafafa",
    "overlay": "#ffffff",
    "raised": "#ebebeb",
    "text": "#171717",
    "muted": "#484848",
    "faint": "#696969",
    "accent": "#155dfc",
    "accent_strong": "#1447e6",
    "danger": "#e7000b",
    "warning": "#e17100",
    "success": "#009966",
    "on_accent": "#fafafa",
    "comment": "#7a7a7a",
    "keyword": "#6454dc",
    "string": "#11694e",
    "number": "#a0511a",
    "special": "#c62075"
  }
}
