{
  "$schema": "https://raw.githubusercontent.com/mxmvncnt/desktop-rs/main/docs/theme.schema.json",
  "id": "tokyo-night",
  "label": "Tokyo Night",
  "dark": {
    "bg": "#1a1b26",
    "surface": "#16161e",
    "card": "#1c1d29",
    "overlay": "#24283b",
    "raised": "#292e42",
    "text": "#c0caf5",
    "muted": "#9aa5ce",
    "faint": "#565f89",
    "accent": "#7aa2f7",
    "accent_strong": "#3d59a1",
    "danger": "#f7768e",
    "warning": "#e0af68",
    "success": "#9ece6a",
    "on_accent": "#1a1b26",
    "comment": "#565f89",
    "keyword": "#bb9af7",
    "string": "#9ece6a",
    "number": "#ff9e64",
    "special": "#e0af68"
  },
  "light": {
    "bg": "#e1e2e7",
    "surface": "#d5d6db",
    "card": "#dcdde3",
    "overlay": "#f0f0f5",
    "raised": "#c8cad3",
    "text": "#343b58",
    "muted": "#4c505e",
    "faint": "#6172b0",
    "accent": "#2e7de9",
    "accent_strong": "#3760bf",
    "danger": "#f52a65",
    "warning": "#8c6c3e",
    "success": "#587539",
    "on_accent": "#ffffff",
    "comment": "#848cb5",
    "keyword": "#9854f1",
    "string": "#587539",
    "number": "#b15c00",
    "special": "#8c6c3e"
  }
}
